bid_id,vendor_name,vendor_rank,vendor_price,price_raw,status_flag
9323923,M/S M.P.TRADERS Under PMA,,,,MII
9323923,Shiva Sales Corporation Under PMA,,,,MII
9323923,SS PROFESSIONAL SERVICES LLP Under PMA,,,,MII
9323506,ASHOKA ENGINEERING WORKS Under PMA,,,,MII MSE
9323506,BLUE THROAT LIMITED Under PMA,,,,MII MSE
9323506,Raj Motor store Under PMA,,,,MII MSE
9315824,M/S SHREE ENTERPRISES Under PMA,,,,Offline upload
9315824,OMG ENGINEERING Under PMA,,,,Offline upload
9315824,TRIPATI ENTERPRISES Under PMA,,,,Offline upload
9315781,M/S SHREE ENTERPRISES Under PMA,,,,Offline upload
9315781,OMG ENGINEERING Under PMA,,,,Offline upload
9315781,TRIPATI ENTERPRISES Under PMA,,,,Offline upload
9323261,A S S SECURITY GROUP Under PMA,,,,MSE
9323261,ABSF MANAGEMENT INDIA PRIVATE LIMITED Under PMA,,,,N/A
9323261,ADITHI GLOBAL CARE PRIVATE LIMITED Under PMA,,,,MSE
9323261,AEROTEK SERVICES Under PMA,,,,MSE
9323261,ALBERTO TECHNOLOGIES Under PMA,,,,MSE
9323261,ALLIANCE OUTSOURCING PRIVATE LIMITED Under PMA,,,,MSE
9323261,AMPUG Solutions Under PMA,,,,MSE
9323261,ANANYA SERVICES Under PMA,,,,MSE
9323261,ANJANIPUTAR MANPOWER SERVICES Under PMA,,,,N/A
9323261,ARIHANT OUTSOURCING SOLUTIONS Under PMA,,,,MSE
9323261,ARYAN BIZZ PRIVATE LIMITED Under PMA,,,,MSE
9323261,ASHFORD STAFFING (OPC) PRIVATE LIMITED Under PMA,,,,MSE
9323261,ASIAN HAWKS MANPOWER SERVICES PRIVATE LIMITED Under PMA,,,,MSE
9323261,ATIREKA SHRAMIKA PRIVATE LIMITED Under PMA,,,,MSE
9323261,AWADH SECURITY SERVICES PRIVATE LIMITED Under PMA,,,,N/A
9323261,axis sales corp. Under PMA,,,,MSE
9323261,B D MOBEL PRIVATE LIMITED Under PMA,,,,MSE
9323261,B.P. CONSTRUCTION Under PMA,,,,MSE
9323261,BALAJI ENTERPRISES Under PMA,,,,MSE
9323261,BD SECURITY Under PMA,,,,MSE
9323261,BEENA SECURITY SERVICE Under PMA,,,,MSE
9323261,BEST INDIA SOLUTION Under PMA,,,,MSE
9323261,BHAGWATI MANPOWER SERVICES Under PMA,,,,MSE
9323261,BHANU UDAY SECURITY SERVICES Under PMA,,,,MSE
9323261,BHARAT KRISHI PASHUPALAN KENDRA Under PMA,,,,MSE
9323261,BRIGHT ENTERPRISES Under PMA,,,,MSE
9323261,CAPTAIN SUNLIGHT SECURITY AGENCY PRIVATE LIMITED Under PMA,,,,MSE
9323261,CHANDRA HOSPITALITY SERVICE Under PMA,,,,MSE
9323261,CITY HAWKS MANPOWER SERVICES AND CONSULTANCY PRIVATE LIMITED Under PMA,,,,MSE
9323261,COMPASS VISION SERVICES Under PMA,,,,MSE
9323261,COMPASVISION INFOTECH (OPC) PRIVATE LIMITED Under PMA,,,,MSE
9323261,COUNTRYWIDE TECHNOLOGIES PRIVATE LIMITED Under PMA,,,,MSE
9323261,DRIVYA SECURITY AND INTEGRATED SERVICES PRIVATE LIMITED Under PMA,,,,MSE
9323261,DRONE SECURITY AGENCY Under PMA,,,,MSE
9323261,ECO ANN ORGANIC PRIVATE LIMITED Under PMA,,,,MSE
9323261,EJEE COMPLETE OFFICE SOLUTIONS PRIVATE LIMITED Under PMA,,,,MSE
9323261,EMPVIN CONSULTANCY PRIVATE LIMITED Under PMA,,,,MSE
9323261,EVOLUTION STAFFING LLP Under PMA,,,,MSE
9323261,EVORV PRIVATE LIMITED Under PMA,,,,MSE
9323261,G.K.ENTERPRISE Under PMA,,,,MSE
9323261,GEONOVATECH INFRA AND SERVICES PRIVATE LIMITED Under PMA,,,,MSE
9323261,GILL ENTERPRISES Under PMA,,,,MSE
9323261,Global Infra Solution Under PMA,,,,MSE
9323261,GOLDEN TRIANGLE SECURITY SERVICE PRIVATE LIMITED Under PMA,,,,MSE
9323261,Growing Manpower Service Under PMA,,,,MSE
9323261,GUNJAN GLOBAL INFRAVENTURE Under PMA,,,,MSE
9323261,GUPTA ENTERPRISES Under PMA,,,,MSE
9323261,GURU NANAK SECURITY Under PMA,,,,MSE
9323261,HELIS CONSULTING PRIVATE LIMITED Under PMA,,,,MSE
9323261,Helis Technologies Under PMA,,,,MSE
9323261,INSF INDIA PRIVATE LIMITED Under PMA,,,,N/A
9323261,INTELLISMART ENERGY SOLUTIONS Under PMA,,,,MSE
9323261,IRON WOLF SECURITY LLP Under PMA,,,,MSE
9323261,ISHITA SECURITY AND MANPOWER SERVICE PRIVATE LIMITED Under PMA,,,,MSE
9323261,J B SECURITY SERVICE Under PMA,,,,MSE
9323261,J B TRADING CO Under PMA,,,,MSE
9323261,J K ENTERPRISES Under PMA,,,,MSE
9323261,J N ENTERPRISES Under PMA,,,,MSE
9323261,J SHARP PRIVATE LIMITED Under PMA,,,,MSE
9323261,J.S Enterprises Under PMA,,,,MSE
9323261,JAGADVYAPI FACILITIES PRIVATE LIMITED Under PMA,,,,MSE
9323261,JAI BHOLENATH SERVICES Under PMA,,,,MSE
9323261,JAI DURGA SHAKTI SERVICES Under PMA,,,,MSE
9323261,JAI JAWALAJI SECURITY AND MANPOWER SERVICES PRIVATE LIMITED Under PMA,,,,N/A
9323261,JAIN CORPORATION Under PMA,,,,MSE
9323261,JIVANSH HANS PRIVATE LIMITED Under PMA,,,,MSE
9323261,JKM TOTAL SECURITY (OPC) PRIVATE LIMITED Under PMA,,,,MSE
9323261,JSR ENTERPRISES Under PMA,,,,MSE
9323261,K P N SAI INFRA PRIVATE LIMITED Under PMA,,,,MSE
9323261,Kanishk Enterprises Under PMA,,,,MSE
9323261,KARMBHUMI ENGINEERING & FACILITY MANAGEMENT PRIVATE LIMITED Under PMA,,,,MSE
9323261,KAYRA MANPOWER SUPPLIER Under PMA,,,,MSE
9323261,KESHWISE NEXUS PRIVATE LIMITED Under PMA,,,,N/A
9323261,KGM Enterprise Under PMA,,,,MSE
9323261,KINSHIP SERVICES Under PMA,,,,MSE
9323261,KR ASSOCIATES Under PMA,,,,MSE
9323261,KULDEEP COMMUNICATION & ELECTRONICS Under PMA,,,,MSE
9323261,LAADU SHYAM KISHORI SECURITIES PRIVATE LIMITED Under PMA,,,,MSE
9323261,LAKSHYARAJ ASSOCIATES Under PMA,,,,N/A
9323261,LEAD SALES AND SUPPLY Under PMA,,,,N/A
9323261,M.M. EAGLES SECURITY Under PMA,,,,MSE
9323261,M.S. ENTERPRISES Under PMA,,,,MSE
9323261,M/S AADITYA ENTERPRISES Under PMA,,,,N/A
9323261,M/S AWADH GROUP Under PMA,,,,N/A
9323261,M/S BANKE BIHARI SERVICES AND MANPOWER SUPPLYAR Under PMA,,,,MSE
9323261,M/S BHAGWATI SERVICES Under PMA,,,,MSE
9323261,M/S DOLE ENTERPRISES Under PMA,,,,MSE
9323261,M/S NIRBHIK INDIA SERVICES Under PMA,,,,MSE
9323261,MADWA ASSOCIATES Under PMA,,,,MSE
9323261,MAHI IT GLOBAL INDIA PRIVATE LIMITED Under PMA,,,,MSE
9323261,Marg Enterprises Under PMA,,,,MSE
9323261,MAXWELL MULTISERVICES & CONSTRUCTIONS PRIVATE LIMITED Under PMA,,,,MSE
9323261,National Services and Manpower Supply Under PMA,,,,MSE
9323261,NEGIE INFOTECH Under PMA,,,,MSE
9323261,New Tiger Security Services Under PMA,,,,MSE
9323261,NISHIDA AGENCY Under PMA,,,,N/A
9323261,NOKN INDIA PRIVATE LIMITED Under PMA,,,,MSE
9323261,OJN FACILITIES PRIVATE LIMITED Under PMA,,,,MSE
9323261,OM SHREE PAWANPUTRA SERVICES Under PMA,,,,MSE
9323261,OMILA MAHABALA ANANTA PRIVATE LIMITED Under PMA,,,,MSE
9323261,ONE SOLUTION Under PMA,,,,MSE
9323261,PARI MANPOWER ENTERPRISES (OPC) PRIVATE LIMITED Under PMA,,,,MSE
9323261,PARV TRADERS Under PMA,,,,MSE
9323261,PHR ENTERPRISES Under PMA,,,,MSE
9323261,Pihu Manpower Service Under PMA,,,,MSE
9323261,PINK RIDER PRIVATE LIMITED Under PMA,,,,MSE
9323261,PLANET SECURITY PRIVATE LIMITED Under PMA,,,,MSE
9323261,PLAYMATE OUTSOURCING SERVICES PRIVATE LIMITED Under PMA,,,,MSE
9323261,PM SERVICES Under PMA,,,,MSE
9323261,PMS INT BHATTHA Under PMA,,,,MSE
9323261,PR ASSOCIATE Under PMA,,,,MSE
9323261,PRAKASHTAM SECURITY & FACILITY PRIVATE LIMITED Under PMA,,,,MSE
9323261,PREEKSHIT MANPOWER PRIVATE LIMITED Under PMA,,,,MSE
9323261,PRITHVI MANPOWER SOLUTIONS PRIVATE LIMITED Under PMA,,,,MSE
9323261,PROHIRE ELITE ENTERPRISES LLP Under PMA,,,,MSE
9323261,PUNJAB SERVICE AGENCY Under PMA,,,,N/A
9323261,R J PRIME SERVICES Under PMA,,,,MSE
9323261,R K ENTERPRISES Under PMA,,,,MSE
9323261,R M ENTERPRISES Under PMA,,,,MSE
9323261,R.V.ENTERPRISE Under PMA,,,,MSE
9323261,RAJENDRA  TIWARI CONTRACTOR Under PMA,,,,N/A
9323261,RAJNAR EMPOWERMENT SERVICES Under PMA,,,,N/A
9323261,RAPID SERVICES AGENCY Under PMA,,,,N/A
9323261,Ravi Enterprises Under PMA,,,,MSE
9323261,RAVLEEN SECURITY PRIVATE LIMITED Under PMA,,,,MSE
9323261,Rawat G and R Associates Under PMA,,,,MSE
9323261,RIDHISIDHI TEAM SOLUTIONS Under PMA,,,,MSE
9323261,RM ENTERPRISES Under PMA,,,,MSE
9323261,ROHHIT ENTERPRISES Under PMA,,,,MSE
9323261,ROMAN SEVEN SECURITY PRIVATE LIMITED Under PMA,,,,N/A
9323261,ROYAL DIGITAL SOLUTIONS Under PMA,,,,MSE
9323261,RPY MANPOWER SOLUTION PRIVATE LIMITED Under PMA,,,,MSE
9323261,RRPERFECT SECURITY SERVICES INDIA PRIVATE LIMITED Under PMA,,,,MSE
9323261,RS ENTERPRISE Under PMA,,,,MSE
9323261,SADHNA SECURITY SERVICES Under PMA,,,,MSE
9323261,Sai A1 Services Under PMA,,,,N/A
9323261,SAI PTP SOLUTIONS LLP Under PMA,,,,MSE
9323261,SAMRAT SECURITY SERVICES PRIVATE LIMITED Under PMA,,,,MSE
9323261,SAMRIDHI GREEN FORCE PRIVATE LIMITED Under PMA,,,,N/A
9323261,SARSP TECH SERVICES PRIVATE LIMITED Under PMA,,,,MSE
9323261,SEBUSHI SERVICES PRIVATE LIMITED Under PMA,,,,MSE
9323261,SECURITY AND INTELLIGENCE SERVICES BUREAU Under PMA,,,,N/A
9323261,SHAMMI MITTAL Under PMA,,,,N/A
9323261,SHANKARMEERA SR SERVICES PRIVATE LIMITED Under PMA,,,,N/A
9323261,SHERWOOD SECURITY & MANPOWER SERVICES PRIVATE LIMITED Under PMA,,,,MSE
9323261,SHIVARCHITA MANPOWER SERVICES PRIVATE LIMITED Under PMA,,,,MSE
9323261,SHIVDULARI ENTERPRISES PRIVATE LIMITED Under PMA,,,,MSE
9323261,SHREE BHOMIYAJI TROOPS PRIVATE LIMITED Under PMA,,,,MSE
9323261,SHREE SHYAM ENTERPRISES Under PMA,,,,MSE
9323261,SHRI KRISHNA CONSTRUCTIONS Under PMA,,,,MSE
9323261,SHRI OM MAN POWER SERVICE PROVIDER Under PMA,,,,MSE
9323261,SHUBHAM ENTERPRISE Under PMA,,,,MSE
9323261,SIDHESHWAR SECURITY SERVICES Under PMA,,,,N/A
9323261,SK ENTERPRISES SOLUTIONS LLP Under PMA,,,,MSE
9323261,SNEPRA SECURE SERVICES PRIVATE LIMITED Under PMA,,,,MSE
9323261,SPSMS GLOBAL PRIVATE LIMITED Under PMA,,,,MSE
9323261,SRA INFO SOLUTIONS Under PMA,,,,MSE
9323261,SRV ENTERPRISE Under PMA,,,,MSE
9323261,SSS SECURITY FORCE (OPC) PRIVATE LIMITED Under PMA,,,,MSE
9323261,SUNSPIRE-SKY PRIVATE LIMITED Under PMA,,,,MSE
9323261,SUPERMAN SECURITY SERVICES PRIVATE LIMITED Under PMA,,,,MSE
9323261,SVIAN SECURITY PRIVATE LIMITED Under PMA,,,,N/A
9323261,TALENT EXCEL PRIVATE LIMITED Under PMA,,,,MSE
9323261,TEJASHIV MANPOWER SERVICE Under PMA,,,,MSE
9323261,TMS SECURITY SERVICES Under PMA,,,,MSE
9323261,TOTAL OFFICE SOLUTION Under PMA,,,,MSE
9323261,TROMSO SERVICES PRIVATE LIMITED Under PMA,,,,MSE
9323261,TS MANPOWER SERVICES Under PMA,,,,MSE
9323261,Ujjwal common service center Under PMA,,,,MSE
9323261,UPANYA DEVELOPERS AND MANPOWER SERVICES PRIVATE LIMITED Under PMA,,,,MSE
9323261,V K ENTERPRISES Under PMA,,,,MSE
9323261,VAISHNAVI ENTERPRISES Under PMA,,,,MSE
9323261,VAJRA SECURITY SERVICES Under PMA,,,,N/A
9323261,VAMIKA CORPORATE SERVICES Under PMA,,,,MSE
9323261,VANSH MANPOWER SOLUTIONS PRIVATE LIMITED Under PMA,,,,MSE
9323261,VCS Education Healthcare & Outsourcing Under PMA,,,,MSE
9323261,VEERVAYU ASSOCIATES Under PMA,,,,N/A
9323261,VERTEX WORKFORCE PRIVATE LIMITED Under PMA,,,,N/A
9323261,VG MANPOWER SERVICES PRIVATE LIMITED Under PMA,,,,N/A
9323261,VILOHITA SKYBUILT PRIVATE LIMITED Under PMA,,,,MSE
9323261,WEBORNET PRIVATE LIMITED Under PMA,,,,MSE
9323261,WHITELION EXIM SECURITY PRIVATE LIMITED Under PMA,,,,MSE
9323261,WORLD SPACE Under PMA,,,,N/A
9323261,Xumify Under PMA,,,,MSE
9323261,YASH R SOLUTION Under PMA,,,,MSE
9323261,ZEALOUS SECURATOR PRIVATE LIMITED Under PMA,,,,MSE
9359607,ARMED FORCE EX SERVICEMAN WELFARE CO OPERATIVE SOCIETY LIMITED Under PMA,L1,1375011.0,` 1375011.00,
9359607,MOHINDER ROAD LINES Under PMA,L2,1384604.1,` 1384604.10,
9359607,THE DESERT STORM Under PMA,L3,1387801.8,` 1387801.80,
9321975,CHINTAHARAN RETAILER LIMITED Under PMA,,,,N/A
9321975,M/S CHINTAHARAN ENTERPRISES Under PMA,,,,N/A
9321975,SHRI HARI INFOTECH Under PMA,,,,N/A
9311878,KAVYA TRADERS Under PMA,,,,MSE
9311878,NAINA ENTERPRISES Under PMA,,,,MSE
9311878,SAMRIDDHI ENTERPRISES Under PMA,,,,MSE
9353305,FAYAZ AHMAD MALIK GENERAL ORDER SUPPLIER Under PMA,,,,N/A
9353305,M/S MOHAMMAD AFZAL MAGRAY Under PMA,,,,N/A
9353305,WASEEM AHMAD MALIK Under PMA,,,,N/A
9321986,M/S  NEW WAVES Under PMA,,,,Offline upload
9321986,M/S ADARSH ENTER PRISES Under PMA,,,,Offline upload
9321986,M/S V. TEL MARKETIND AND COMMUNICATION Under PMA,,,,Offline upload
9358789,"M/S VERSHA ASSOCIATES, VARANASI Under PMA",L1,1014000.0,` 1014000.00,
9358789,TRIMURTI SUPPLIERS AND CONTRACTORS Under PMA,L2,1020000.0,` 1020000.00 (Bid Price),
9358789,POOJA ENTERPRISES Under PMA,L3,1080000.0,` 1080000.00 (Bid Price),
9353780,"MA TARA ENTERPRISE (MSE,MII) Under PMA",L1,629661.02,` 629661.02,
9353780,"CMS TECHNO SERVICES (MSE,MII) Under PMA",L2,631288.14,` 631288.14,
9353780,"MICROMECH EQUIPMENTS (MSE,MII) Under PMA",L3,693200.0,` 693200.00,
9353780,"MODERN POWER ENGINEERING COMPANY (MSE,MII) Under PMA",L4,699090.0,` 699090.00,
9353780,THE MINING & ENGINEERING CORPORATION (MSE) Under PMA,L5,835593.22,` 835593.22,
9353780,"DURGAPUR CASTING & ALLIED PRODUCTS PVT LTD (MSE,MII) Under PMA",L6,949152.54,` 949152.54 (Bid Price),
9353780,"HOWRAH STEEL & METALCRAFTS PRIVATE LIMITED (MSE,MII) Under PMA",L7,1647864.41,` 1647864.41 (Bid Price),
9358909,NTECNOVIC SOLUTIONS PRIVATE LIMITED Under PMA,L1,7787520.0,` 7787520.00,
9358909,ADARSH ENTERPRISES Under PMA,L2,7802496.0,` 7802496.00,
9358909,AARU SECURE PRIVATE LIMITED Under PMA,L3,7817472.0,` 7817472.00,
9358909,RANA SON'S & COMPANY Under PMA,L4,7862400.0,` 7862400.00 (Bid Price),
9358750,"M/S SUBHADRA STEEL (MSE,MII) Under PMA",L1,2722684.0,` 2722684.00,
9358750,"M/s JSB CONSTRUCTION (MSE,MII) Under PMA",L2,2750000.0,` 2750000.00 (Bid Price),
9358750,"M/S T.N.T. ENTERPRISES (MSE,MII) Under PMA",L3,2800000.0,` 2800000.00 (Bid Price),
9321604,DISTRICT SPORTS CENTER Under PMA,,,,N/A
9321604,M/S HARI OM ENTERPRISES GARUR Under PMA,,,,N/A
9321604,SHRI HARI TRADERS Under PMA,,,,N/A
9321502,JAY ENTERPRISES Under PMA,,,,Offline upload
9321502,M. K. ENTERPRISES Under PMA,,,,Offline upload
9321502,MAA VAISHNO ENTERPRISES Under PMA,,,,Offline upload
9358592,"SHRADHA CHEMIST (MSE,MII) Under PMA",L1,1079995.0,` 1079995.00,
9358592,"PROMPT PHARMA (MSE,MII) Under PMA",L2,1081399.5,` 1081399.50,
9358592,"MAHADEV ENTERPRISE (MSE,MII) Under PMA",L3,1101661.0,` 1101661.00,
9358581,"STAR NUKE CONSULTING ENGINEERING SERVICES PRIVATE LIMITED (MSE,MII) Under PMA",L1,40000.0,` 40000.00,
9358581,"TECHNOMAC MEDICAL SYSTEMS PRIVATE LIMITED (MSE,MII) Under PMA",L2,41000.0,` 41000.00,
9358581,ABA TECHNOLOGIES (MII) Under PMA,L3,63000.0,` 63000.00,
9299692,KONARK ENGINEERS & TRADERS Under PMA,,,,N/A
9299692,KULBUSHAN KUMAR Under PMA,,,,MSE
9299692,M/S T&D CONSTRUCTION AND TRADING CO. Under PMA,,,,MSE
9299692,MADHAV ENTERPRISES Under PMA,,,,N/A
9299692,SUPER POWER ENTERPRISES Under PMA,,,,MSE
9305749,ELITE TECHNOLOGIES Under PMA,,,,N/A
9305749,EXTREME I T SOLUTIONS Under PMA,,,,MSE
9305749,Smart Technologies Under PMA,,,,N/A
9358399,"M/S SHREE DURGA ENTERPRISE (MSE,MII) Under PMA",L1,1315000.0,` 1315000.00,
9358399,"M/S RAJ ASSOCIATE, UDMARI BORJHARGAON, DEKARGAON. (MSE,MII) Under PMA",L2,1780000.0,` 1780000.00 (Bid Price),
9358399,"SHEKHAWAT INDUSTRIES (MSE,MII) Under PMA",L3,1825000.0,` 1825000.00 (Bid Price),
9358394,"S. B. TRADING COMPANY (MSE,MII) Under PMA",L1,1782174.0,` 1782174.00,
9358394,"M/S AMIT TRADERS (MSE,MII) Under PMA",L2,1784014.0,` 1784014.00 (Bid Price),
9358394,"J. B. ASSOCIATES (MSE,MII) Under PMA",L3,1785029.0,` 1785029.00 (Bid Price),
9358313,M/S SUNRISE SYSTEM (MSE) Under PMA,L1,198500.0,` 198500.00,
9358313,M/S RIDHI AGENCY (MSE) Under PMA,L2,206000.0,` 206000.00 (Bid Price),
9358313,M/S RUDHRANI ENTERPRISES Under PMA,L3,210000.0,` 210000.00 (Bid Price),
9321186,Ananya Enterprises Under PMA,,,,N/A
9321186,DIVYA WATER PLAZA Under PMA,,,,MSE
9321186,M/S SHARDA ENTERPRISES Under PMA,,,,MSE
9315715,M/S SHREE ENTERPRISES Under PMA,,,,Offline upload
9315715,OMG ENGINEERING Under PMA,,,,Offline upload
9315715,TRIPATI ENTERPRISES Under PMA,,,,Offline upload
9320999,Aggarwal Suppliers Under PMA,,,,N/A
9320999,BALAJI ENTERPRISES Under PMA,,,,MSE
9320999,INDIAN TRADERS Under PMA,,,,N/A
9320970,Aggarwal Suppliers Under PMA,,,,N/A
9320970,BALAJI ENTERPRISES Under PMA,,,,MSE
9320970,INDIAN TRADERS Under PMA,,,,N/A
9310083,BALAJI TRADERS Under PMA,,,,MSE
9310083,Kanchan Traders Under PMA,,,,MSE
9358225,NUTORAS FOODS PRIVATE LIMITED (MSE) Under PMA,L1,29339.75,` 29339.75,
9358225,P. G. ENTERPRISE Under PMA,L2,31255.0,` 31255.00 (Bid Price),
9358225,J P Trading Under PMA,L3,31490.0,` 31490.00 (Bid Price),
9358223,NUTORAS FOODS PRIVATE LIMITED (MSE) Under PMA,L1,24345.75,` 24345.75,
9358223,J P Trading Under PMA,L2,24570.0,` 24570.00 (Bid Price),
9358223,RUDRAKXI'S Under PMA,L3,24765.0,` 24765.00 (Bid Price),
9358222,NUTORAS FOODS PRIVATE LIMITED (MSE) Under PMA,L1,22327.75,` 22327.75,
9358222,P. G. ENTERPRISE Under PMA,L2,22360.0,` 22360.00 (Bid Price),
9358222,J P Trading Under PMA,L3,22575.0,` 22575.00 (Bid Price),
9358222,RUDRAKXI'S Under PMA,L4,22790.0,` 22790.00 (Bid Price),
9358104,KHALSA TRADERS (MSE) Under PMA,L1,421068.2,` 421068.20,
9358104,SHREE SHYAM ENTERPRISES (MSE) Under PMA,L2,476235.0,` 476235.00 (Bid Price),
9358104,JANKI ENTERPRISES (MSE) Under PMA,L3,476470.0,` 476470.00 (Bid Price),
9316908,JAPLEEN TRADERS Under PMA,,,,MSE
9316908,M/S AGAM TRADERS Under PMA,,,,MSE
9316908,M/S I.R. ENTERPRISES Under PMA,,,,N/A
9320931,Aggarwal Suppliers Under PMA,,,,N/A
9320931,BALAJI ENTERPRISES Under PMA,,,,MSE
9320931,INDIAN TRADERS Under PMA,,,,N/A
9320910,DILIP AUTO AGENCY Under PMA,,,,MSE
9320910,RUDRA AUTO SERVICES Under PMA,,,,MSE
9320910,SHAH AUTOMOBILES Under PMA,,,,MSE
9320856,ARUN SHARMA GOVT CONTRACTOR Under PMA,,,,N/A
9320856,S.S. ENTERPRISES Under PMA,,,,MSE
9320856,U T TRADERS Under PMA,,,,MSE
9320822,LAKSHITA SALES AND SERVICES PRIVATE LIMITED Under PMA,,,,MSE
9320822,MAHADEV ENTERPRISES Under PMA,,,,MSE
9320822,MANISH TRADING COMPANY Under PMA,,,,MSE
9320632,D R ENTERPRISES Under PMA,,,,N/A
9320632,R T ENTERPRISES Under PMA,,,,N/A
9320632,SHREE COMPUTER AND ENTERPRISES Under PMA,,,,N/A
9320586,D R ENTERPRISES Under PMA,,,,N/A
9320586,R T ENTERPRISES Under PMA,,,,N/A
9320586,SHREE COMPUTER AND ENTERPRISES Under PMA,,,,N/A
9315451,APEX ENTERPRISES Under PMA,,,,MSE
9315451,COSMIK ENTERPRISES Under PMA,,,,MSE
9315451,hospitech industry Under PMA,,,,MSE
9315399,ARMY ENTERPRISES Under PMA,,,,N/A
9315399,L B ENTERPRISES Under PMA,,,,N/A
9315399,MAHAVIR MOTOR Under PMA,,,,N/A
9309999,BHARAT AGENCIES Under PMA,,,,MSE
9309999,RAJAN DIESELS Under PMA,,,,MSE
9309999,SPR AUTOMOBILES Under PMA,,,,MSE
9317608,BHAGWATI SUPPLIERS Under PMA,,,,MSE
9317608,S.S. ENTERPRISES Under PMA,,,,MSE
9317608,WEST END MOTORS Under PMA,,,,MSE
9320548,D R ENTERPRISES Under PMA,,,,N/A
9320548,R T ENTERPRISES Under PMA,,,,N/A
9320548,SHREE COMPUTER AND ENTERPRISES Under PMA,,,,N/A
9351403,DEVENDRA IT INFRASOFT SECURITY PRIVATE LIMITED Under PMA,L1,1288500.0,` 1288500.00,
9351403,Mannat InfoTech Under PMA,L2,1291968.0,` 1291968.00,
9351403,B. J. AUTOMATION Under PMA,L3,1344525.0,` 1344525.00,
9351403,COMPUTRONIX Under PMA,L4,1399257.0,` 1399257.00,
9351403,PROFESSIONAL TECHSYS PRIVATE LIMITED Under PMA,L5,1950825.0,` 1950825.00 (Bid Price),
9351403,DATA CARE CORPORATION Under PMA,L6,2375151.21,` 2375151.21 (Bid Price),
9351403,TECHNOPOINT SOLUTIONS PRIVATE LIMITED Under PMA,L7,2501625.0,` 2501625.00 (Bid Price),
9351403,PACE BUSINESS MACHINES PRIVATE LIMITED Under PMA,L8,2600000.25,` 2600000.25 (Bid Price),
9351403,ACTIVE ENTERPRISE Under PMA,L9,2620875.0,` 2620875.00 (Bid Price),
9351403,Laxmi Computers Under PMA,L10,2737812.0,` 2737812.00 (Bid Price),
9351403,PUTHUR INFOTECH PRIVATE LIMITED Under PMA,L11,2791881.0,` 2791881.00 (Bid Price),
9356872,"S. B. TRADING COMPANY (MSE,MII) Under PMA",L1,1783662.0,` 1783662.00,
9356872,"M/S AMIT TRADERS (MSE,MII) Under PMA",L2,1785502.0,` 1785502.00 (Bid Price),
9356872,"J. B. ASSOCIATES (MSE,MII) Under PMA",L3,1786252.0,` 1786252.00 (Bid Price),
9355327,"HUNDAL DENTAL TRADERS (MSE,MII) Under PMA",L1,459359.3,` 459359.30,
9355327,"V S ENTERPRISES (MSE,MII) Under PMA",L2,460002.0,` 460002.00,
9355327,"AFFIX HEALTH CARE (MSE,MII) Under PMA",L3,477288.0,` 477288.00,
9355327,"CBN ENTERPRISES (MSE,MII) Under PMA",L4,667994.0,` 667994.00 (Bid Price),
9357140,H R ENTERPRISES Under PMA,L1,2566000.0,` 2566000.00,
9357140,ADVIK ENERGY SOLUTION PRIVATE LIMITED Under PMA,L2,2570000.0,` 2570000.00 (Bid Price),
9357140,OFFICE SOLUTION INC Under PMA,L3,2571600.0,` 2571600.00 (Bid Price),
9315850,G S TRADER Under PMA,,,,N/A
9315850,REYISHA CLOSET Under PMA,,,,N/A
9315850,SINGH ENTERPRISES Under PMA,,,,N/A
9319913,D R ENTERPRISES Under PMA,,,,N/A
9319913,R T ENTERPRISES Under PMA,,,,N/A
9319913,SHREE COMPUTER AND ENTERPRISES Under PMA,,,,N/A
9355770,"M/S M4 ENTERPRISES (MSE,MII) Under PMA",L1,19141690.0,` 19141690.00,
9355770,"ABDUL RASHID & SONS (MSE,MII) Under PMA",L2,19179220.0,` 19179220.00,
9355770,"VALLEY ROAD CONSTRUCTION COMPANY (MSE,MII) Under PMA",L3,19896716.0,` 19896716.00 (Bid Price),
9355770,"ABDUL RASHID KABOO (MSE,MII) Under PMA",L4,20258218.0,` 20258218.00 (Bid Price),
9355770,QAZI CONSTRUCTIONS (MSE) Under PMA,L5,21279468.83,` 21279468.83 (Bid Price),
9318218,INDIAN INDUSTRIAL SECURITY SERVICES Under PMA,,,,MSE
9318218,M/S COMMERCIAL TRADING COMPANY Under PMA,,,,MSE
9318218,SANGRAM BUILDCON Under PMA,,,,Registered with designated Agency / Authority
9317298,INDIAN INDUSTRIAL SECURITY SERVICES Under PMA,,,,N/A
9317298,M/S COMMERCIAL TRADING COMPANY Under PMA,,,,N/A
9317298,SANGRAM BUILDCON Under PMA,,,,N/A
9350346,G.U. Enterprises Under PMA,,,,MSE
9350346,MAA SATI ENTERPRISES Under PMA,,,,MSE
9350346,Planet Security Group Under PMA,,,,MSE
9350346,RK INFRASTRUCTURE SERVICES Under PMA,,,,MSE
9350346,Tech Solutions Under PMA,,,,MSE
9356751,P.Y. TRADERS Under PMA,L1,40196.0,` 40196.00,
9356751,VRP Enterprises Under PMA,L2,54600.0,` 54600.00 (Bid Price),
9356742,"GARG & GARG CO. (MSE,MII) Under PMA",L1,29087915.0,` 29087915.00,
9356742,LSR INFRACON PRIVATE LIMITED (MSE) Under PMA,L2,29129273.0,` 29129273.00,
9315772,M/S SHREE ENTERPRISES Under PMA,,,,Offline upload
9315772,OMG ENGINEERING Under PMA,,,,Offline upload
9315772,TRIPATI ENTERPRISES Under PMA,,,,Offline upload
9315771,M/S SHREE ENTERPRISES Under PMA,,,,Offline upload
9315771,OMG ENGINEERING Under PMA,,,,Offline upload
9315771,TRIPATI ENTERPRISES Under PMA,,,,Offline upload
9355719,NEW P.C WORLD (MII) Under PMA,L1,3445200.0,` 3445200.00,
9355719,"Arsh Sales Corp (MSE,MII) Under PMA",L2,3449000.0,` 3449000.00,
9355719,"STELLAR TECHNOLOGIES (MSE,MII) Under PMA",L3,3790500.0,` 3790500.00 (Bid Price),
9355242,"PLA ELECTRO APPLIANCES PVT LTD (MSE,MII) Under PMA",L1,3619566.0,` 3619566.00,
9355242,"NUCLEONIX SYSTEMS PVT.LTD. (MSE,MII) Under PMA",L2,3624699.0,` 3624699.00,
9355851,"Prince and Princess Enterprises (MSE,MII) Under PMA",L1,987155.0,` 987155.00,
9355851,"INNOVATIVE TECH ZONE (MSE,MII) Under PMA",L2,1065735.0,` 1065735.00 (Bid Price),
9355851,"SABHARWAL ENTERPRISES (MSE,MII) Under PMA",L3,1074050.0,` 1074050.00 (Bid Price),
9355630,"GENERAL SUPPLY CO. (MSE,MII) Under PMA",L1,4841914.0,` 4841914.00,
9355630,"CLIFTEN INC (MSE,MII) Under PMA",L2,5024795.0,` 5024795.00,
9355630,"VEENA ENTERPRISES (MSE,MII) Under PMA",L3,5309374.0,` 5309374.00 (Bid Price),
9318131,M/S TECHNOCRAT ELECTRICAL Under PMA,,,,MSE
9318131,SARASWAT ELECTRICALS Under PMA,,,,N/A
9318131,VASU ENTERPRISE Under PMA,,,,N/A
9315770,M/S SHREE ENTERPRISES Under PMA,,,,Offline upload
9315770,OMG ENGINEERING Under PMA,,,,Offline upload
9315770,TRIPATI ENTERPRISES Under PMA,,,,Offline upload
9315769,M/S SHREE ENTERPRISES Under PMA,,,,Offline upload
9315769,OMG ENGINEERING Under PMA,,,,Offline upload
9315769,TRIPATI ENTERPRISES Under PMA,,,,Offline upload
9313286,AMARAVATI ENTERPRISES Under PMA,,,,MSE
9313286,M/S SINGH TRADERS Under PMA,,,,MSE
9313286,POOJA ENTERPRISES Under PMA,,,,MSE
9355376,RUDRA ENTERPRISES (MII) Under PMA,L1,498000.0,` 498000.00,
9355376,YUG ENTERPRISE (MII) Under PMA,L2,501500.0,` 501500.00,
9355376,INTELLO ENTERPRISE (MII) Under PMA,L3,512350.0,` 512350.00,
9318098,AUTO TRADERS Under PMA,,,,MII MSE
9318098,Nirmal Pushpa Traders Under PMA,,,,MII MSE
9318098,RST ENTERPRISES Under PMA,,,,MII MSE
9317898,CCS INFOSYSTEMS Under PMA,,,,MSE
9317898,FR TECHNO SOLUTIONS Under PMA,,,,MSE
9317898,HI-TECH CORPORATION Under PMA,,,,MSE
9317898,I. T. ENTERPRISES Under PMA,,,,MSE
9317851,NAWBHARAT TRADE AGENCY Under PMA,,,,MSE
9317851,NEXUS INDIA Under PMA,,,,MSE
9317851,SWATI ENTERPRISE Under PMA,,,,MSE
9354330,A S RAJPUT ALLIED SERVICES Under PMA,L1,360780.0,` 360780.00,
9354330,KHATRI TOUR & TRAVELS Under PMA,L2,361200.0,` 361200.00,
9354330,CLASSIC CAR RENTAL SERVICES PRIVATE LIMITED Under PMA,L3,370920.0,` 370920.00,
9354330,HIGHWAY MOTORS Under PMA,L4,372000.0,` 372000.00,
9354330,S R ENTERPRISES Under PMA,L5,378000.0,` 378000.00,
9354330,SHREE SHYAM ENTERPRISES Under PMA,L6,456000.0,` 456000.00 (Bid Price),
9354330,RIDHI ENTERPRISES Under PMA,L7,466656.0,` 466656.00 (Bid Price),
9353678,CYPROS TECHNOLOGIES PRIVATE LIMITED Under PMA,L1,11000.0,` 11000.00,
9353678,PYRAMID CYBER SECURITY & FORENSIC PRIVATE LIMITED Under PMA,L2,11980.0,` 11980.00,
9353678,ANB SOLUTIONS PRIVATE LIMITED Under PMA,L3,16000.0,` 16000.00,
9353678,SECNIC CONSULTANCY SERVICES PRIVATE LIMITED Under PMA,L4,17650.0,` 17650.00,
9353678,SECURIUM SOLUTIONS PRIVATE LIMITED Under PMA,L5,41300.0,` 41300.00 (Bid Price),
9353678,LEVITHAN TECHNOLOGIES PRIVATE LIMITED Under PMA,L6,42480.0,` 42480.00 (Bid Price),
9353678,PHOENIX TECHNOCYBER Under PMA,L7,59000.0,` 59000.00 (Bid Price),
9353678,ALLIED BOSTON CONSULTANTS INDIA PRIVATE LIMITED Under PMA,L7,59000.0,` 59000.00 (Bid Price),
9349340,CHORDIYA TRAVELS Under PMA,,,,N/A
9349340,MOHIT TRAVELS Under PMA,,,,N/A
9349340,sagar travels Under PMA,,,,N/A
9333995,AB ENTERPRISES Under PMA,,,,MII
9333995,METHODEX SYSTEMS PRIVATE LIMITED Under PMA,,,,MII
9333995,SALASAR TRADE LINKERS Under PMA,,,,MII
9317617,JAGJIT TRADERS Under PMA,,,,MII MSE
9317617,KHOSA ENTERPRISES Under PMA,,,,MII MSE
9317617,RK ENTERPRISES Under PMA,,,,MII MSE
9317530,ARMY TRADING CO. Under PMA,,,,MII MSE
9317530,HIMACHAL MOTORS Under PMA,,,,MII
9317530,RAJINDRA & RAJINDRA MOTORS Under PMA,,,,MII MSE
9317501,RAMA ENTERPRISES Under PMA,,,,MSE
9317501,SHAILYA ENTERPRISES Under PMA,,,,MSE
9317501,VIRAM HITECH SOLUTIONS LLP Under PMA,,,,MSE
9317451,BHARDWAJ TRADERS Under PMA,,,,MSE
9317451,M/S GUPTA SPARE & REPAIR Under PMA,,,,MSE
9317451,PREMANAND ENTERPRISES Under PMA,,,,MSE
9317442,Byahut Enterprises Under PMA,,,,N/A
9317442,MAA DURGA AGROTECH Under PMA,,,,N/A
9317442,SAUBHYAA ENTERPRISES Under PMA,,,,N/A
9317312,AGGARWAL TRADING COMPANY Under PMA,,,,MSE
9317312,SHIV SHAKTI Under PMA,,,,MSE
9317312,SINGLA & COMPANY Under PMA,,,,MSE
