bid_id,vendor_name,vendor_rank,vendor_price,price_raw,status_flag
9296100,RS INTEGRATORS PRIVATE LIMITED Under PMA,L3,856000.0,` 856000.00 (Bid Price),
9296100,HIND DEFENCE EQUIPMENTS PRIVATE LIMITED Under PMA,L4,1000457.46,` 1000457.46 (Bid Price),
9296100,SECURITY ENGINEERS PRIVATE LIMITED Under PMA,L5,1076622.88,` 1076622.88 (Bid Price),
9296100,VIHAWK TECH SOLUTIONS PRIVATE LIMITED Under PMA,L6,1225477.0,` 1225477.00 (Bid Price),
9252290,AGNI INDUSTRY Under PMA,,,,MSE
9252290,AGNISATHI INDUSTRIAL FIRE AND SAFETY PRIVATE LIMITED Under PMA,,,,N/A
9252290,Creative Protection Devices Under PMA,,,,MSE
9252290,FIRE INDUSTRY Under PMA,,,,MSE
9252290,M/S AJANTA INTERNATIONAL Under PMA,,,,MSE
9252290,Pareek Enterprises Under PMA,,,,N/A
9252290,SAFETY POINT Under PMA,,,,MSE
9252290,SHREEJI FIRE SAFETY Under PMA,,,,MSE
9252290,SMART MEDIA Under PMA,,,,N/A
9252290,SUSHMA SAFETY SOLUTIONS Under PMA,,,,MSE
9252290,TRIHASTI TRADE & CO Under PMA,,,,N/A
9252290,WB ROCKSTAR FIRE SERVICES PRIVATE LIMITED Under PMA,,,,MSE
9185599,HANVIKA ENTERPRISES Under PMA,,,,Registered with designated Agency / Authority
9185599,K L TRADERS Under PMA,,,,Registered with designated Agency / Authority
9185599,LABNOVA DIAGNOSTICS AND HEALTHCARE PRODUCTS Under PMA,,,,Registered with designated Agency / Authority
9185599,MEENAKSHI KRISHNA ENTERPRISES Under PMA,,,,Registered with designated Agency / Authority
9185599,MOHAN ENTERPRISES Under PMA,,,,Registered with designated Agency / Authority
9185599,Sri ayyappa enterprises Under PMA,,,,Registered with designated Agency / Authority
9185599,SRI HARI PRIYA SERVICES Under PMA,,,,Registered with designated Agency / Authority
9185599,SRI SAI VARSHITA SERVICES Under PMA,,,,Registered with designated Agency / Authority
9185599,TRIPURA ENTERPRISES Under PMA,,,,Registered with designated Agency / Authority
9185599,viswa construction projects company Under PMA,,,,Registered with designated Agency / Authority
9263373,ACN UDYOG Under PMA,,,,Registered with designated Agency / Authority
9263373,ASMITA GRAMEEN UDHYOG Under PMA,,,,MSE
9263373,CLEAN & GREEN EQUIPMENTS PRIVATE LIMITED Under PMA,,,,Registered with designated Agency / Authority
9263373,DEVI ENTERPRISES Under PMA,,,,MSE
9263373,DEVPATI ENTERPRISES Under PMA,,,,Offline upload
9263373,GHANSHYAM FABRICATORS Under PMA,,,,MSE
9263373,Kedarnath  Enterprises Under PMA,,,,Offline upload
9263373,M/s ASHA ENTERPRISES Under PMA,,,,Offline upload
9263373,OM ENTERPRISE Under PMA,,,,MSE
9302562,"M/S VINOD TRADING COMPANY (MSE,MII) Under PMA",L1,3810000.0,` 3810000.00,
9302562,"B.S CONSTRUCTIONS (MSE,MII) Under PMA",L2,3820320.0,` 3820320.00,
9302562,"M/S GARG TRADING COMPANY (MSE,MII) Under PMA",L3,3895000.0,` 3895000.00 (Bid Price),
9307822,Emerging Solutions Under PMA,L1,300000.0,` 300000.00,
9307822,ELECTRO SERVICES PRIVATE LIMITED Under PMA,L2,304500.0,` 304500.00,
9307822,M/S DEEP INFOTECH Under PMA,L3,340000.0,` 340000.00 (Bid Price),
9307822,AIRCON COMMUNICATIONS Under PMA,L4,390000.0,` 390000.00 (Bid Price),
9307822,JK SERVICES Under PMA,L5,395000.0,` 395000.00 (Bid Price),
9307822,B R PRINT SOLUTIONS Under PMA,L6,398000.0,` 398000.00 (Bid Price),
9307877,K AND K COMPANY (MII) Under PMA,L1,5073476.0,` 5073476.00,
9307877,R K DUMRA (MII) Under PMA,L2,5096265.0,` 5096265.00,
9307877,SHAM LAL DEEPAK KUMAR (MII) Under PMA,L3,5372752.0,` 5372752.00 (Bid Price),
9300732,KANAK CATERS AND EVENT ORGANISORS & PRAVEEN TRAVELS Under PMA,,,,N/A
9300732,OM SALES & SERVICES Under PMA,,,,MSE
9300732,PAL TOUR AND TRAVELS AND TRANSPORT SERVICE Under PMA,,,,MSE
9300732,REVA ENTERPRISES Under PMA,,,,N/A
9300732,RIYANSH MANPOWER SERVICES Under PMA,,,,N/A
9300732,SURYAM TRADE & TRAVELS Under PMA,,,,N/A
9300732,VISHAL BAJAJ Under PMA,,,,N/A
9273172,KUMAR ENTERPRISES Under PMA,,,,MSE
9273172,P.S ENTERPRISES Under PMA,,,,MSE
9273172,Sukhmani Traders Under PMA,,,,MSE
9273061,Gayatri Enterprises Under PMA,,,,N/A
9273061,HINDUSTAN TRADING CORPORATION Under PMA,,,,MSE
9273061,PRATEEK MOTORS Under PMA,,,,MSE
9273050,Gayatri Enterprises Under PMA,,,,N/A
9273050,HINDUSTAN TRADING CORPORATION Under PMA,,,,MSE
9273050,PRATEEK MOTORS Under PMA,,,,MSE
9273039,M/S KARTIK SALES CORPORATION Under PMA,,,,MSE
9273039,M/S M. K. ENTERPRISES Under PMA,,,,N/A
9273039,PITAMBRA TRADERS Under PMA,,,,MSE
9302648,"SHREE SHYAM TRADERS (MSE,MII) Under PMA",L1,925763.0,` 925763.00,
9302648,"M/s SHRI BALAJI ENTERPRISES (MSE,MII) Under PMA",L2,961680.0,` 961680.00,
9302648,MAHALAXMI ENTERPRISES (MII) Under PMA,L3,1052815.0,` 1052815.00,
9285656,DEEP ENTERPRISES Under PMA,,,,N/A
9285656,MISHRA MARINE ENGINEERING WORKS Under PMA,,,,N/A
9285656,RD ENTERPRISE Under PMA,,,,N/A
9273123,BRIEGHT SERVICE AND SUPPLIER Under PMA,,,,N/A
9273123,PAWAN KIRANA Under PMA,,,,N/A
9273123,PAWAN TRADERS Under PMA,,,,N/A
9273043,Dtech Engineering Under PMA,,,,N/A
9273043,FINE ENTERPRISE Under PMA,,,,N/A
9273043,M.M.ENTERPRISES Under PMA,,,,N/A
9272947,M.U.N. AGRO INDUSTRIES PRIVATE LIMITED Under PMA,,,,MSE
9272947,Zenith Enterprises Under PMA,,,,N/A
9272511,Anand Auto Centre Under PMA,,,,Central / State PSUs
9272511,Bikash Enterprises Under PMA,,,,Central / State PSUs
9272511,NANDI TRADERS Under PMA,,,,Central / State PSUs
9272511,SOSING ENTERPRISE Under PMA,,,,Central / State PSUs
9272511,VAJRA ENTERPRISES Under PMA,,,,Central / State PSUs
9271000,Abhinandan Suppliers and Services Under PMA,,,,MII MSE
9271000,Argus Global System Under PMA,,,,MII
9271000,FIRM ENTERPRISES Under PMA,,,,MII MSE
9271000,N.S.ENTERPRISES Under PMA,,,,MII MSE
9271000,R BROTHER GROUP Under PMA,,,,MII MSE
9271000,SANGHU ENERGY SAVING SYSTEMS PRIVATE LIMITED Under PMA,,,,MII MSE
9271000,VIDEOLOGY Under PMA,,,,MII MSE
9271000,Zenith Enterprises Under PMA,,,,MII MSE
9268823,Anand Auto Centre Under PMA,,,,Central / State PSUs
9268823,Bikash Enterprises Under PMA,,,,Central / State PSUs
9268823,NANDI TRADERS Under PMA,,,,Central / State PSUs
9268823,SOSING ENTERPRISE Under PMA,,,,Central / State PSUs
9268823,VAJRA ENTERPRISES Under PMA,,,,Central / State PSUs
9260958,ACS System Solutions Under PMA,,,,MSE
9260958,Avni Computer Solution Under PMA,,,,N/A
9260958,Pinnacle Enterprises Under PMA,,,,N/A
9260958,S & N TECHNOLOGIES Under PMA,,,,MSE
9260958,SAXENA TRADERS Under PMA,,,,MSE
9260958,SEAGUL INFOTECH Under PMA,,,,MSE
9260958,STAR INFORMATICS Under PMA,,,,MSE
9260958,VG TECHNOLOGIES PRIVATE LIMITED Under PMA,,,,MSE
9261828,J M TECH SOLUTION Under PMA,,,,MSE
9261828,JAY KAY ASSOCIATES Under PMA,,,,N/A
9261828,MAHAJAN AND CO Under PMA,,,,N/A
9259913,G. H. ENTERPRISES Under PMA,,,,ACASH
9259913,KISHAN FORCE Under PMA,,,,Registered with designated Agency / Authority
9259913,PR ASSOCIATES Under PMA,,,,ACASH
9259913,SHUBH FABRI WORKS Under PMA,,,,ACASH
9259913,UMRA KHARIAN CORPORATION Under PMA,,,,Central / State PSUs
9259885,CLEAN & GREEN EQUIPMENTS PRIVATE LIMITED Under PMA,,,,Registered with designated Agency / Authority
9259885,G. H. ENTERPRISES Under PMA,,,,ACASH
9259885,GHANSHYAM FABRICATORS Under PMA,,,,MSE
9259885,OM ENTERPRISE Under PMA,,,,MSE
9259885,PR ASSOCIATES Under PMA,,,,ACASH
9259885,SAIWIN LIGHTS Under PMA,,,,Registered with designated Agency / Authority
9259885,SHUBH FABRI WORKS Under PMA,,,,ACASH
9259885,THE MONA & COMPANY Under PMA,,,,MSE
9259871,CLEAN & GREEN EQUIPMENTS PRIVATE LIMITED Under PMA,,,,Registered with designated Agency / Authority
9259871,G. H. ENTERPRISES Under PMA,,,,ACASH
9259871,GHANSHYAM FABRICATORS Under PMA,,,,MSE
9259871,OM ENTERPRISE Under PMA,,,,MSE
9259871,PR ASSOCIATES Under PMA,,,,ACASH
9259871,SHUBH FABRI WORKS Under PMA,,,,ACASH
9259871,SPHERETAIL VENTURES INDIA PRIVATE LIMITED Under PMA,,,,Registered with designated Agency / Authority
9259652,M/S BHARAT ELECTRICALES Under PMA,,,,N/A
9259652,M/S SHIWAM CONSTRUCTION Under PMA,,,,N/A
9259652,M/S SUPRIYA TRADING COMPANY Under PMA,,,,N/A
9259652,MASS INFOMEDIA Under PMA,,,,MSE
9259652,ROYAL ENTERPRISES Under PMA,,,,N/A
9259652,SAURABH AGRO CHEMICALS Under PMA,,,,MSE
9259324,BENAKA TECHNOLOGIES Under PMA,,,,MII
9259324,INDIFOSS ANALYTICAL PRIVATE LIMITED Under PMA,,,,MII
9259324,NEER SYSTEMS Under PMA,,,,MII
9259324,PRINTER CARE Under PMA,,,,MII
9259324,PROMPT EQUIPMENTS PRIVATE LIMITED Under PMA,,,,MII
9259324,SHREE KAMDHENU ELECTRONICS PRIVATE LIMITED Under PMA,,,,MII
9259237,BENAKA TECHNOLOGIES Under PMA,,,,MII
9259237,INDIFOSS ANALYTICAL PRIVATE LIMITED Under PMA,,,,MII
9259237,NEER SYSTEMS Under PMA,,,,MII
9259237,PRINTER CARE Under PMA,,,,MII
9259237,PROMPT EQUIPMENTS PRIVATE LIMITED Under PMA,,,,MII
9259237,SHREE KAMDHENU ELECTRONICS PRIVATE LIMITED Under PMA,,,,MII
9302889,ATS SERVICES Under PMA,,,,MSE
9302889,M/s Raj Nandini Industrial Enterprises Under PMA,,,,N/A
9302889,S M ENTERPRISE Under PMA,,,,N/A
9302889,SUNIL AGRI. IMPLIMENTS MFG. WORKS Under PMA,,,,MSE
9277783,Kavya Enterprises Under PMA,,,,MSE
9277783,M/S KARTIK SALES CORPORATION Under PMA,,,,MSE
9277783,M/S M. K. ENTERPRISES Under PMA,,,,N/A
9277783,PITAMBRA TRADERS Under PMA,,,,MSE
9302832,M/s Raj Nandini Industrial Enterprises Under PMA,,,,N/A
9302832,S M ENTERPRISE Under PMA,,,,N/A
9302832,SUNIL AGRI. IMPLIMENTS MFG. WORKS Under PMA,,,,MSE
9302660,SUMAN ENGINEERING WORKS Under PMA,L1,3702000.0,` 3702000.00,
9302660,RANJIT & ASSOCIATES Under PMA,L2,3720000.0,` 3720000.00,
9302563,VERMA ENTERPRISES Under PMA,L1,8970000.0,` 8970000.00,
9302563,M/S SAI & CO Under PMA,L2,8998000.0,` 8998000.00,
9302563,AKISHA ENGINEERING SOLUTION SERVICES PRIVATE LIMITED Under PMA,L3,14000000.0,` 14000000.00 (Bid Price),
